card-heading,slick-active,rating-badge,light,objective,objective 2,readMoreSmall
1. Srikalahasteeswara Temple,1.0,3.5,/5,2 km from city center,Temple,"Famed as the Kailash of the south, this is the only temple in India where one can witness Lord Shiva embraced in the form of Vayulinga. With elaborate artwork and designs, each with a history and legend of its own, this is one of the most beautiful religious sites in the town."
2. Veyilingala Kona Waterfall,1.0,3.1,/5,7 km from city center,Waterfall,"Literally translating into 'the valley of the thousand lingas', the Veyilingala Kona Waterfall are one of the favorite spots of both locals and visitors."
3. Sri Subrahmanya Swamy Temple,1.0,3.1,/5,0 km from city center,Temple,"At the centre of the city, is a significant temple dedicated to Lord Murugan. A modest climb of 150 steps take you to the Sri Subrahmanya Swamy Temple, surrounded by flattering views of all that''s around and wide sprawling courtyards."
4. Bharadwaja Tirtham,1.0,3.1,/5,1 km from city center,Temple,"With hills and streams around, the Bharadwaja Tirtham is a religious site with some of the most beautiful surroundings. The statue of Vinayaka with water all around, makes the spot all the more enchanting. One of the popular attractions of the town, this is a must visit area, while here."
5. Sahasra Linga Temple,,3.1,/5,14 km from city center,Temple,"Find inside this temple, a sprawling 1000 Shiva lingas carved out of a single idol, granting the temple its name. With a forest and hills around, the temple finds itself in a serene background, making a visit to this area all the more fascinating."
6. Shopping in Srikalahasti,,3.0,/5,0 km from city center,Shopping,The town is known for a version of Kalamkari called Srikalamkari or Srikalahasti Kalamkari i.e. hand worked traditional paintings. Find these ethnic artworks at the BP Agraharams or the Sriram Nagar Colony. One can also find a lot of religious items and artifacts here.
7. Bhakta Kannappa Temple,,3.1,/5,1 km from city center,Temple,"The temple houses an idol of Bhakta Kannappa and is tied to the legend that a tribal youth called Bhakta Kannappa gave his eyes to the Lord Shiva idol in the temple. Respecting his devotion, offerings are made to Bhakta Kannappa before they are to Shiva Linga, in this temple."
8. Durgambika Temple,,3.1,/5,0 km from city center,Temple,"Steps through a hillock, surrounded by wide views takes one to a an ancient dedicated to Goddess Durgambika. Like most areas in the area, this one too finds itself a scenic backdrop and much natural beauty around."
9. Aadi Krithigai Festival,,,,,Fairs & Festivals,"One of the most significant festivals of Tamil Nadu, Aadi Krithigai is the celebration of the powers of Lord Murugan. Devotees offer their prayers with special pujas, yagnas and participating in the chariot processions of Murugan in the hopes of aligning goodness and prosperity with their lives."
