source_place,pub_name,pub_area,destination_landmark,walking_distance_km,estimated_walk_time_minutes,walking_direction_steps,starting_landmark,ending_landmark,road_name,route_type,safe_for_night_walk,street_lighting,best_time_to_walk,crowd_level,nightlife_zone,nearby_places_on_route,google_maps_walk_link,description
Maddilapalem,The Hangover Pub & Kitchen - MVP,MVP Colony Sector 4,D-Mart MVP Colony,1.2,15,"From Maddilapalem main junction, walk north on the road connecting to MVP Colony. Enter MVP Colony via the Sector 4 side. Walk towards D-Mart superstore. The Hangover Pub is right near D-Mart in Sector 4.",Maddilapalem Junction,D-Mart MVP Colony - Sector 4,Maddilapalem Road then MVP Colony Road,Neighbourhood walk,Yes,Good - residential and colony road,7 PM - 11 PM,Moderate,Maddilapalem - MVP Border Zone,"D-Mart MVP, MVP Colony Sector 4, Bheemunipatnam Road",https://maps.google.com/?q=The+Hangover+Pub+Kitchen+MVP+Visakhapatnam,Walk from Maddilapalem northward into MVP Colony to reach The Hangover Pub near the D-Mart anchor store.
Maddilapalem,Wok Republic Lounge,MVP Colony Sector 10,Bheemunipatnam Road Junction,1.0,12,"From Maddilapalem junction, head north on the main road towards MVP Colony. Enter the colony from Sector 9-10 end. Walk towards Bheemunipatnam Road. Wok Republic Lounge is near Bheemunipatnam Road in Sector 10.",Maddilapalem Main Junction,Wok Republic Entrance - Sector 10,Maddilapalem Road then MVP Colony Sector 10 Road,Road and colony walk,Yes,Good - main road lighting,7 PM - 11 PM,Moderate,MVP Colony North Nightlife Zone,"MVP Colony, Bheemunipatnam Road, Maddilapalem Market",https://maps.google.com/?q=Wok+Republic+Lounge+MVP+Colony+Visakhapatnam,Walk from Maddilapalem into the MVP Colony Sector 10 end to the Wok Republic Lounge near Bheemunipatnam Road.
Kailasagiri,Marco Polo Bar & Lounge,Beach Road - Kailasagiri,Kailasagiri Ropeway Base,0.4,5,"From Kailasagiri hilltop ropeway station base, walk north on Beach Road towards RK Beach direction. Pass the Tenneti Park viewpoint. Marco Polo Bar & Lounge is on Beach Road facing the sea on the right side.",Kailasagiri Ropeway Base Station,Marco Polo Bar Entrance - Beach Road,Beach Road,Coastal road walk,Yes,Good - tourist zone,7 PM - 11 PM,Moderate,Kailasagiri Beach Zone,"Tenneti Park, Kailasagiri Ropeway, RK Beach",https://maps.google.com/?q=Marco+Polo+Bar+Lounge+Kailasagiri+Beach+Road+Visakhapatnam,Walk down from the Kailasagiri ropeway base along the beautiful Beach Road to Marco Polo Bar with sea views.
Kailasagiri,Sea Inn Rooftop Lounge,Maharanipeta - Beach Road,Tenneti Park Junction,0.5,6,"From Kailasagiri cable car base, walk north along Beach Road past Tenneti Park. Sea Inn Rooftop Lounge is visible on Beach Road near Maharanipeta with its rooftop sign lit up from the street.",Kailasagiri Cable Car Base,Sea Inn Rooftop - Maharanipeta Beach Road,Beach Road,Scenic coastal walk,Yes,Good - tourist zone lighting,7 PM - 11 PM,Moderate,Kailasagiri - RK Beach Belt,"Tenneti Park, Kailasagiri View, Maharanipeta",https://maps.google.com/?q=Sea+Inn+Rooftop+Lounge+Maharanipeta+Visakhapatnam,Pleasant walk along Beach Road from the Kailasagiri base up towards Maharanipeta and the Sea Inn Rooftop Lounge.
Kailasagiri,WelcomHotel Lounge Bar,Beach Road - Seethammadhara,WelcomHotel - Beach Road Seethammadhara,0.6,8,"From Kailasagiri ropeway base, walk south on Beach Road towards Seethammadhara. Pass the beach stretch. WelcomHotel is prominently visible on the sea-facing side of Beach Road near the Seethammadhara area.",Kailasagiri Ropeway Base,WelcomHotel Beach Road,Beach Road,Coastal road walk,Yes,Good - hotel zone,7 PM - 11 PM,Moderate,Kailasagiri - Seethammadhara Coast,"WelcomHotel, Beach Road, Seethammadhara",https://maps.google.com/?q=WelcomHotel+Lounge+Bar+Beach+Road+Seethammadhara+Visakhapatnam,Scenic stroll south along Beach Road from Kailasagiri to the WelcomHotel Lounge in the Seethammadhara belt.
Hanumanthuwaka,Novotel Restobar & Lounge,Jagadamba Junction,Jagadamba Junction,1.3,16,"From Hanumanthuwaka main road junction, walk south towards Jagadamba. Pass the YMCA road cross. Continue to Commissioner Office Road. Novotel Hotel is on Commissioner Office Road near YMCA Ground just before Jagadamba junction.",Hanumanthuwaka Junction,Novotel Hotel Entrance - Commissioner Office Road,Hanumanthuwaka Road then Commissioner Office Road,City road walk,Yes,Good - main road lighting,7 PM - 11 PM,Moderate,Jagadamba City Zone,"YMCA, Commissioner Office, Jagadamba Junction",https://maps.google.com/?q=Novotel+Restobar+Jagadamba+Visakhapatnam,Walk from Hanumanthuwaka southward along the main city road to the Novotel Restobar near Jagadamba junction.
Hanumanthuwaka,Dolphin Hotel Bar - Aquarius,Daba Garden - 75 Feet Road,Dolphin Hotel - 75 Feet Road,1.4,17,"From Hanumanthuwaka, take the road heading towards Daba Garden. Connect to 75 Feet Road. Walk south on 75 Feet Road. Dolphin Hotel is at the junction of 75 Feet Road and Daba Garden Road, prominently visible from the main road.",Hanumanthuwaka Main Junction,Dolphin Hotel 75 Feet Road Entrance,Hanumanthuwaka Road then 75 Feet Road,Main city road walk,Yes,Good - 75 Feet Road lighting,7 PM - 10 PM,Moderate,Daba Garden Nightlife Zone,"Daba Garden, 75 Feet Road, Beach Road Junction",https://maps.google.com/?q=Dolphin+Hotel+Bar+Aquarius+Daba+Garden+Visakhapatnam,Walk from Hanumanthuwaka towards Daba Garden via 75 Feet Road to the iconic Dolphin Hotel bar.
Seethammadhara,Escape Nightclub,Seethammadhara - VUDA Complex,VUDA Complex Main Entrance,0.3,4,"From Seethammadhara main junction on Beach Road, walk south along Beach Road. VUDA Complex is on the left side of Beach Road. Escape Nightclub is near the VUDA Complex gate, well-lit with its signboard visible at night.",Seethammadhara Main Junction,VUDA Complex Entrance - Beach Road,Beach Road,Short road walk,Yes,Excellent - busy road,9 PM - 2 AM,High on weekends,Seethammadhara Nightlife Zone,"VUDA Complex, Beach Road, Seethammadhara Cross Road",https://maps.google.com/?q=Escape+Nightclub+VUDA+Seethammadhara+Visakhapatnam,Short walk from Seethammadhara junction to Vizag's favourite nightclub near the VUDA Complex on Beach Road.
Seethammadhara,WelcomHotel Lounge Bar,Beach Road - Seethammadhara,WelcomHotel Entrance,0.4,5,"From Seethammadhara main cross road, walk south on Beach Road. Pass the beach viewpoint. WelcomHotel is on the sea-facing left side of Beach Road, identifiable by the hotel signage and portico entrance.",Seethammadhara Cross Road,WelcomHotel Main Entrance - Beach Road,Beach Road,Coastal road walk,Yes,Excellent - hotel zone lighting,7 PM - 11 PM,Moderate,Seethammadhara Beach Belt,"Beach Road, Kailasagiri View, Seethammadhara Junction",https://maps.google.com/?q=WelcomHotel+Lounge+Bar+Seethammadhara+Visakhapatnam,Short and scenic coastal walk from Seethammadhara cross road to the premium WelcomHotel Lounge on Beach Road.
Seethammadhara,Palm Beach Hotel Lounge,Lawsons Bay Colony,Lawsons Bay Entrance,1.0,13,"From Seethammadhara junction, walk north on Beach Road towards Rushikonda direction. Pass through the beach road stretches. Palm Beach Hotel is at the Lawsons Bay Colony entrance on Beach Road on the sea-facing side.",Seethammadhara Junction,Lawsons Bay Colony Beach Road Entrance,Beach Road,Coastal road walk,Yes,Good - beach road lighting,7 PM - 11 PM,Moderate,Seethammadhara to Lawsons Bay Coast,"Beach Road, Seethammadhara Beach, Lawsons Bay Colony",https://maps.google.com/?q=Palm+Beach+Hotel+Lounge+Lawsons+Bay+Visakhapatnam,A long breezy coastal walk along Beach Road northward from Seethammadhara to the Palm Beach Hotel Lounge at Lawsons Bay.
PM Palem,V Hangout Restobar,MVP Colony Sector 7,MVP Market - Sector 7,1.1,14,"From PM Palem main junction, walk south on the road towards MVP Colony. Enter MVP Colony at the Sector 7 end. Walk towards the MVP Market area. V Hangout Restobar is near the market in Sector 7.",PM Palem Main Junction,MVP Market Sector 7,PM Palem Road then MVP Colony Sector 7 Road,Residential to colony walk,Yes,Good - colony road lighting,7 PM - 11 PM,Moderate,PM Palem - MVP Border Zone,"MVP Market, MVP Colony Sector 7, Bheemunipatnam Road",https://maps.google.com/?q=V+Hangout+Restobar+MVP+Colony+Visakhapatnam,Walk from PM Palem into the MVP Colony area to reach the relaxed V Hangout Restobar near the Sector 7 market.
PM Palem,Wok Republic Lounge,MVP Colony Sector 10,MVP Colony Sector 10,1.3,16,"From PM Palem junction, walk south towards MVP Colony. Enter via Sector 9 or Sector 10 end. Wok Republic Lounge is in Sector 10 near the Bheemunipatnam Road side of the colony.",PM Palem Junction,Wok Republic Entrance - MVP Sector 10,PM Palem Road then MVP Colony Road,Residential to colony walk,Yes,Good - colony and residential lighting,7 PM - 11 PM,Moderate,PM Palem - MVP Colony Zone,"MVP Colony Sectors, Bheemunipatnam Road, PM Palem",https://maps.google.com/?q=Wok+Republic+Lounge+MVP+Colony+Visakhapatnam,Walk south from PM Palem through the residential roads into MVP Colony Sector 10 to reach Wok Republic Lounge.
PM Palem,The Hangover Pub & Kitchen - MVP,MVP Colony Sector 4,D-Mart MVP Colony,1.5,18,"From PM Palem junction, walk south through the residential road to MVP Colony. Enter at the Sector 1 or Sector 4 side. Walk towards D-Mart. The Hangover Pub is right near the D-Mart in Sector 4.",PM Palem Main Junction,D-Mart MVP Colony Sector 4,PM Palem Road then MVP Colony Internal Road,Residential to colony walk,Yes,Good - colony road lighting,7 PM - 11 PM,Moderate,PM Palem - MVP Colony Border,"D-Mart, MVP Sector 4, PM Palem",https://maps.google.com/?q=The+Hangover+Pub+Kitchen+MVP+Visakhapatnam,Walk from PM Palem into MVP Colony to The Hangover Pub near D-Mart - a favourite local spot.
Madhurawada,Rushikonda Beach Club & Bar,Rushikonda Beach,Haritha Beach Resort,2.8,34,"From Madhurawada main junction, take the Beach Road connecting road southward towards Rushikonda. Walk or use the beach road route to Rushikonda Beach. Rushikonda Beach Club is behind Haritha Beach Resort accessible from the beach path.",Madhurawada Junction,Rushikonda Beach - Haritha Resort Gate,Madhurawada-Rushikonda Beach Road,Long coastal approach walk,Yes,Moderate - beach road lighting,6 PM - 10 PM,Moderate,Madhurawada - Rushikonda Coastal Zone,"Rushikonda Beach, APTDC Water Sports, Vizag Zoo",https://maps.google.com/?q=Rushikonda+Beach+Club+Bar+Rushikonda+Visakhapatnam,Long coastal walk from Madhurawada to Rushikonda Beach for the popular beach club behind Haritha Resort.
Madhurawada,Dusk Palm Beach,Rushikonda Beach Road,Rushikonda Beach Main Road,2.5,30,"From Madhurawada junction, head south along Rushikonda Beach Road. This is a gradual downhill road with greenery on both sides. Dusk Palm Beach is on Rushikonda Beach Road with its gate visible as you approach the beach zone.",Madhurawada Main Junction,Dusk Palm Beach Entrance - Rushikonda Beach Road,Rushikonda Beach Road,Long road walk - scenic route,Yes,Moderate - road lighting on main road,6 PM - 10 PM,Moderate,Madhurawada - Rushikonda Beach Road,"Vizag Bypass Area, Rushikonda Road, Rushikonda Beach",https://maps.google.com/?q=Dusk+Palm+Beach+Rushikonda+Visakhapatnam,Scenic downhill walk from Madhurawada along the Rushikonda Beach Road to Dusk Palm Beach lounge.
Madhurawada,Stone Water Eco Resort Pub,Rushikonda Beach,Haritha Beach Resort Rear,2.8,34,"From Madhurawada, walk south on the beach road towards Rushikonda. Continue along Rushikonda Beach Road. Enter Rushikonda beach area and walk the beach path south towards the eco resort cluster behind Haritha.",Madhurawada Main Junction,Stone Water Eco Resort - Rushikonda Beach,Rushikonda Beach Road then Beach Path,Long road and beach walk,Yes,"Moderate - main road lit, beach path dim",6 PM - 10 PM,Low,Madhurawada - Rushikonda Eco Zone,"Rushikonda Beach, Haritha Resort, APTDC Hub",https://maps.google.com/?q=Stone+Water+Eco+Resort+Pub+Rushikonda+Visakhapatnam,Long and scenic walk from Madhurawada to the eco resort pub at Rushikonda Beach for a serene night out.
