source_place,pub_name,pub_area,destination_landmark,walking_distance_km,estimated_walk_time_minutes,walking_direction_steps,starting_landmark,ending_landmark,road_name,route_type,safe_for_night_walk,street_lighting,best_time_to_walk,crowd_level,nightlife_zone,nearby_places_on_route,google_maps_walk_link,description
RK Beach,RK Beach Shack Bar & Nightlife Zone,RK Beach,Submarine Museum Entry Gate,0.3,4,Start at RK Beach main promenade near the volleyball courts. Walk north along the beach path towards Submarine Museum. Pass the INS Kurusura Submarine on your left. The bar zone is right beside the Submarine Museum entrance on Ramakrishna Beach Road.,RK Beach Volleyball Court,Submarine Museum Gate,Ramakrishna Beach Road,Beachfront walk,Yes,Good - street lights along beach road,7 PM - 11 PM,High on weekends,RK Beach Nightlife Strip,"INS Kurusura Submarine, Kali Temple, Beach Promenade",https://maps.google.com/?q=RK+Beach+Shack+Bar+Visakhapatnam,Coastal walk along the iconic RK Beach promenade leading to the popular beach shack bar near Submarine Museum.
RK Beach,Sea Inn Rooftop Lounge,Maharanipeta,Tenneti Park Junction,0.5,7,"From RK Beach entrance, walk south on Beach Road towards Tenneti Park. Cross the Kailasagiri cable car base area. Turn slightly inland on Beach Road near the park junction. Sea Inn Rooftop Lounge is visible above the buildings near the main road.",RK Beach Main Entrance,Tenneti Park Junction,Beach Road,Beachside road walk,Yes,Good - well-lit tourist zone,7 PM - 11 PM,Moderate,RK Beach - Kailasagiri Belt,"Tenneti Park, Kailasagiri Cable Car Base, RK Beach Promenade",https://maps.google.com/?q=Sea+Inn+Rooftop+Lounge+Visakhapatnam,Pleasant evening stroll along Beach Road past Tenneti Park to reach the rooftop lounge with sea views.
RK Beach,Marco Polo Bar & Lounge,Beach Road - Kailasagiri End,Kailasagiri Road Junction,0.7,9,Begin at the RK Beach main entrance. Walk south along Beach Road towards Kailasagiri. Pass Tenneti Park on your right. Continue on Beach Road past the petrol station. Marco Polo Bar is visible near the Kailasagiri Road turnoff on Beach Road.,RK Beach Main Entrance,Kailasagiri Road Junction,Beach Road,Coastal road walk,Yes,Good - lit road,8 PM - 11 PM,Moderate,Beach Road - Kailasagiri Zone,"Tenneti Park, Kailasagiri Ropeway, INS Kurusura",https://maps.google.com/?q=Marco+Polo+Bar+Lounge+Visakhapatnam,A breezy evening walk south along Beach Road with sea on one side and hillside greenery approaching Kailasagiri.
RK Beach,Horizon Restaurant,Daba Garden - 75 Feet Road,Dolphin Hotel Entrance,1.4,17,"From RK Beach, walk north along Beach Road past the volleyball courts. At the Naval Base flyover, turn left and take the 75 Feet Road inland. Walk past Daba Garden colony lanes. Dolphin Hotel is at the junction of 75 Feet Road and Daba Garden Road on the 7th floor.",RK Beach North End,Dolphin Hotel Main Gate,Beach Road then 75 Feet Road,Beachside to inland road walk,Yes,Good - well-lit main road,7 PM - 10 PM,Moderate,Daba Garden - Beach Road Belt,"Naval Base Gate, Daba Garden Cross Roads, 75 Feet Road Junction",https://maps.google.com/?q=Horizon+Restaurant+Dolphin+Hotel+Visakhapatnam,Walk from RK Beach along the coast and into the Daba Garden residential area to the iconic Dolphin Hotel rooftop restaurant.
RK Beach,Tap The Sports Bar,Beach Road - Varun Beach,Varun Beach INOX Cinema,1.0,13,Start at RK Beach main entrance. Walk north on Beach Road past the naval areas. Continue past the flyover and reach Varun Beach stretch. INOX Cinema is prominently visible on your left. Tap The Sports Bar is in the Varun INOX complex directly on Beach Road.,RK Beach Entrance,Varun Beach INOX Cinema,Beach Road,Beach promenade walk,Yes,Excellent - commercial strip,7 PM - 11 PM,High on weekends,Varun Beach - Beach Road,"Varun Beach, INOX Cinema, Naval Officers Club",https://maps.google.com/?q=Tap+The+Sports+Bar+Visakhapatnam,Energetic walk along the Beach Road promenade from RK Beach heading north to the popular sports bar inside the INOX cinema complex.
Beach Road,Tap The Sports Bar,Beach Road - Varun Beach,Varun INOX Entrance,0.2,3,"From Beach Road main stretch near Maharanipeta, walk north along Beach Road. Varun INOX Cinema complex is visible within a short walk on the left side of the road. The bar entrance is inside the complex on ground floor.",Beach Road - Maharanipeta Stretch,Varun INOX Building,Beach Road,Flat road walk,Yes,Excellent - commercial lighting,7 PM - 11 PM,High on weekends,Beach Road Central,"INOX Cinema, Navy Base Junction, RK Beach Promenade",https://maps.google.com/?q=Tap+The+Sports+Bar+Varun+Beach+Visakhapatnam,A short evening stroll on the well-lit Beach Road to the popular sports bar inside Varun INOX multiplex.
Beach Road,ZOOM RESTAURANT AND BAR,Beach Road,Gokul Park Entrance,0.4,5,"From the central Beach Road stretch near Maharanipeta bus stop, walk south along Beach Road. Pass the children's play area. Gokul Park is clearly visible ahead on your right. ZOOM Restaurant and Bar is directly opposite Gokul Park on Beach Road.",Beach Road Bus Stop - Maharanipeta,Gokul Park Gate,Beach Road,Beachside road walk,Yes,Good - tourist zone lights,7 PM - 11 PM,Moderate to High,Beach Road South Strip,"Gokul Park, Beach Promenade, Maharanipeta Market",https://maps.google.com/?q=ZOOM+Restaurant+Bar+Beach+Road+Visakhapatnam,Easy flat walk along the beach road from Maharanipeta to the ZOOM restaurant bar directly facing Gokul Park.
Beach Road,Harbour Vue,Varun Beach - Nowroji Road,Varun Beach Promenade,0.5,6,Start at Beach Road near Marriott Hotel stretch. Walk north towards Nowroji Road junction. Turn left at Nowroji Road crossing. Harbour Vue is situated right on Varun Beach with an entrance from Nowroji Road facing the sea.,Beach Road - Marriott Stretch,Nowroji Road - Varun Beach Junction,Beach Road then Nowroji Road,Beachfront walk,Yes,Good - tourist promenade,7 PM - 11 PM,Moderate,Varun Beach Zone,"Varun Beach, Nowroji Road, YMCA Ground",https://maps.google.com/?q=Harbour+Vue+Varun+Beach+Visakhapatnam,A scenic beach road walk turning into Nowroji Road to reach the breezy Harbour Vue seafront lounge.
Beach Road,Escape Nightclub,Seethammadhara - VUDA Complex Area,VUDA Complex Main Gate,1.8,22,"From central Beach Road near Rushikonda junction end, walk north along Beach Road towards Seethammadhara. Pass the VUDA headquarters on your right. The Escape Nightclub is near the VUDA Complex on Beach Road in Seethammadhara neighbourhood.",Beach Road - Rushikonda Junction,VUDA Complex,Beach Road,Long coastal road walk,Yes,Good - busy road,9 PM - 1 AM,High on weekends,Seethammadhara Beach Belt,"VUDA Complex, Seethammadhara Cross Road, Beach Road Hotels",https://maps.google.com/?q=Escape+Nightclub+VUDA+Seethammadhara+Visakhapatnam,A scenic walk up Beach Road heading towards Seethammadhara ending at one of Vizag's most popular nightclubs.
Beach Road,Palm Beach Hotel Lounge,Lawsons Bay Colony,Lawsons Bay Entrance Junction,1.1,14,"From Beach Road near Kailasagiri turn, continue north along Beach Road. Pass the Rushikonda diversion junction. Continue to the Lawsons Bay Colony entrance on Beach Road. Palm Beach Hotel Lounge is right at this beachfront junction.",Beach Road - Kailasagiri Turn,Lawsons Bay Colony Entrance,Beach Road,Coastal road walk,Yes,Moderate - residential stretch,7 PM - 11 PM,Moderate,Lawsons Bay Beach Zone,"Lawsons Bay Beach, Kailasagiri View Point, Beach Road Hotels",https://maps.google.com/?q=Palm+Beach+Hotel+Lounge+Lawsons+Bay+Visakhapatnam,A relaxed walk up Beach Road through the quieter coastal belt to the Palm Beach Hotel Lounge at Lawsons Bay.
Rushikonda,Rushikonda Beach Club & Bar,Rushikonda Beach,Haritha Beach Resort Gate,0.3,4,Start at Rushikonda Beach main parking area. Walk south along the beach path towards Haritha Beach Resort. The Beach Club is behind Haritha Beach Resort with a sandy path access. Follow the resort boundary wall to the bar entrance.,Rushikonda Beach Main Parking,Haritha Beach Resort Rear Gate,Rushikonda Beach Road,Beach path walk,Yes,Moderate - resort area lighting,7 PM - 11 PM,Moderate,Rushikonda Beach Zone,"Rushikonda Beach, Haritha Beach Resort, APTDC Water Sports",https://maps.google.com/?q=Rushikonda+Beach+Club+Bar+Visakhapatnam,A short breezy beach path walk from Rushikonda main beach to the popular beach club behind Haritha Resort.
Rushikonda,Stone Water Eco Resort Pub,Rushikonda Beach,Haritha Beach Resort - South End,0.4,5,"From Rushikonda Beach parking, walk along the beach southward. Pass the APTDC water sports area. Continue along the beach path behind Haritha Beach Resort. Stone Water Eco Resort Pub is at the southern end of Rushikonda beach near the eco resort cluster.",Rushikonda Beach Parking,Stone Water Eco Resort Entrance,Rushikonda Beach Path,Beachside eco path walk,Yes,Low - eco resort area,7 PM - 11 PM,Low to Moderate,Rushikonda Eco Zone,"Rushikonda Beach, Haritha Resort, APTDC Water Sports Hub",https://maps.google.com/?q=Stone+Water+Eco+Resort+Pub+Rushikonda+Visakhapatnam,A serene beach walk at Rushikonda to the eco-themed pub nestled behind the Haritha Beach Resort.
Rushikonda,Dusk Palm Beach,Rushikonda Beach Road,Rushikonda Beach Road Main Gate,0.2,3,"From the Rushikonda beach road bus stop, walk 200 metres along Rushikonda Beach Road heading towards the beach. Dusk Palm Beach is directly on Rushikonda Beach Road with its signboard visible from the main road. Enter via the main gate facing the sea.",Rushikonda Beach Road Bus Stop,Dusk Palm Beach Entrance,Rushikonda Beach Road,Short road walk,Yes,Moderate - beach road lighting,6 PM - 11 PM,Moderate,Rushikonda Beach Belt,"Rushikonda Beach, Haritha Resort, Vizag Beach Viewpoints",https://maps.google.com/?q=Dusk+Palm+Beach+Rushikonda+Visakhapatnam,A very short walk from the Rushikonda Beach Road main stop to the attractive Dusk Palm Beach lounge.
Lawson's Bay,Palm Beach Hotel Lounge,Lawsons Bay Colony,Lawsons Bay Beach Viewpoint,0.3,4,"From Lawsons Bay Colony main entrance on Beach Road, walk south along Beach Road for about 300 metres. The Palm Beach Hotel is the prominent building on the sea-facing side of Beach Road near the colony.",Lawsons Bay Colony Gate,Palm Beach Hotel Entrance,Beach Road,Beach road walk,Yes,Moderate - residential beach road,7 PM - 11 PM,Moderate,Lawsons Bay Beach Zone,"Lawsons Bay Beach, Beach Road, Kailasagiri View",https://maps.google.com/?q=Palm+Beach+Hotel+Lounge+Lawsons+Bay+Visakhapatnam,Short and easy walk inside the Lawsons Bay beach stretch to the hotel lounge with sea-facing ambience.
Lawson's Bay,Marco Polo Bar & Lounge,Beach Road - Kailasagiri End,Kailasagiri Ropeway Base,0.8,10,"From Lawsons Bay Colony, walk south on Beach Road. Pass the beach view points. Continue past Tenneti Park junction. Marco Polo Bar & Lounge is on Beach Road near the Kailasagiri road turnoff, visible on the inland side.",Lawsons Bay Colony Entrance,Kailasagiri Road Junction on Beach Road,Beach Road,Coastal road walk,Yes,Good - tourist zone,7 PM - 11 PM,Moderate,Kailasagiri - Beach Road Zone,"Kailasagiri Ropeway, Tenneti Park, Beach Road Promenade",https://maps.google.com/?q=Marco+Polo+Bar+Lounge+Kailasagiri+Visakhapatnam,A pleasant walk south along Beach Road from Lawsons Bay to the Marco Polo bar near the Kailasagiri viewpoint.
Lawson's Bay,WelcomHotel Lounge Bar,Beach Road - Seethammadhara,Kailasagiri Road - Seethammadhara End,0.6,8,"From Lawsons Bay Colony, walk north on Beach Road towards Seethammadhara. Pass the beach shacks on the left. WelcomHotel is on Beach Road near Kailasagiri and Seethammadhara stretch with a prominent seafront facade.",Lawsons Bay Colony Entrance,WelcomHotel Beach Road Entrance,Beach Road,Coastal road walk,Yes,Good - hotel zone lighting,7 PM - 11 PM,Moderate,Beach Road - Seethammadhara,"Kailasagiri, Seethammadhara Cross Road, Beach Road",https://maps.google.com/?q=WelcomHotel+Lounge+Bar+Beach+Road+Visakhapatnam,Short coastal walk north from Lawsons Bay on Beach Road to the premium WelcomHotel Lounge.
Siripuram,Gravity Restobar,Siripuram,Siripuram Junction Signal,0.2,3,"From Siripuram junction main signal, walk 200 metres on VIP Road towards the VIP Center building. Gravity Restobar is located near Siripuram Junction on VIP Road with its entrance visible from the signal.",Siripuram Junction Signal,Gravity Restobar Entrance - VIP Road,VIP Road,Short road walk,Yes,Excellent - commercial area,7 PM - 11 PM,Moderate to High,Siripuram - VIP Road Zone,"Siripuram Junction, CMR Central, Governor Bungalow",https://maps.google.com/?q=Gravity+Restobar+Siripuram+Visakhapatnam,The shortest possible evening walk from Siripuram junction to the lively Gravity Restobar on VIP Road.
Siripuram,Noise Cosmic House,Siripuram - Waltair Main Road,Governor Bungalow - Waltair Main Road,0.3,4,"From Siripuram junction, walk north on Waltair Main Road. Pass Reliance Trends on your right. Noise Cosmic House is on the 2nd floor of the building opposite the Governor Bungalow, clearly visible from street level.",Siripuram Junction,Noise Cosmic House - Waltair Main Road,Waltair Main Road,Short road walk,Yes,Excellent - busy commercial road,8 PM - 1 AM,High on weekends,Siripuram Nightlife Zone,"Governor Bungalow, Siripuram Junction, Reliance Trends",https://maps.google.com/?q=Noise+Cosmic+House+Siripuram+Visakhapatnam,A very short walk from Siripuram junction on Waltair Main Road to the popular nightclub opposite the Governor Bungalow.
Siripuram,"SOMAA, Siripuram",Siripuram - VIP Road,VIP Center Building,0.3,4,"From Siripuram junction, walk straight onto VIP Road. VIP Center is the prominent commercial building on VIP Road 300 metres from the signal. SOMAA Restobar is on the 4th floor, accessible by elevator from the main lobby.",Siripuram Junction Signal,VIP Center Main Entrance,VIP Road,Short flat road walk,Yes,Excellent - commercial zone,7 PM - 12 AM,High on weekends,Siripuram - VIP Road Nightlife Strip,"CMR Central, VIP Road, Siripuram Junction",https://maps.google.com/?q=SOMAA+Siripuram+VIP+Road+Visakhapatnam,"Steps away from Siripuram junction, walk along VIP Road to the stylish SOMAA Restobar on the 4th floor of VIP Center."
Siripuram,Ironhill Visakhapatnam,Siripuram - Waltair Main Road,PMJ Jewellers Building,0.4,5,"From Siripuram junction, walk north along Waltair Main Road. Continue past the Governor Bungalow area. Ironhill Brewery is above PMJ Jewellers on Waltair Main Road, with a staircase entrance clearly visible on the right side.",Siripuram Junction,Ironhill Above PMJ Jewellers Entrance,Waltair Main Road,Short road walk,Yes,Excellent - busy commercial road,6 PM - 11 PM,Moderate to High,Siripuram - Waltair Main Road Zone,"Governor Bungalow, PMJ Jewellers, Siripuram Junction",https://maps.google.com/?q=Ironhill+Visakhapatnam+Waltair+Main+Road,Stroll up Waltair Main Road from Siripuram junction to the popular craft brewery above PMJ Jewellers.
Siripuram,Moon Bar & Kitchen,Siripuram - VIP Road,Westside Showroom - CMR Central,0.4,5,"From Siripuram junction, walk onto VIP Road towards CMR Central. Pass CMR Central mall on your left. Moon Bar & Kitchen is on the 4th floor of the building above Westside on VIP Road, visible as you approach CMR Central.",Siripuram Junction,Westside Showroom - VIP Road,VIP Road,Flat commercial road walk,Yes,Excellent - well-lit mall zone,7 PM - 11 PM,Moderate,CMR Central - VIP Road Zone,"CMR Central Mall, Westside Store, Siripuram Junction",https://maps.google.com/?q=Moon+Bar+Kitchen+VIP+Road+Visakhapatnam,Easy evening walk on VIP Road from Siripuram to the Moon Bar above Westside near CMR Central mall.
Siripuram,Drunken Monkey,Siripuram,Sarvani Sweets - Waltair Main Road,0.3,4,"From Siripuram junction, walk south on Waltair Main Road. Look for Sarvani Sweets landmark on your right. Drunken Monkey is on the 1st floor of Vinayagar Kosala building directly beside Sarvani Sweets.",Siripuram Junction,Sarvani Sweets - Waltair Main Road,Waltair Main Road,Short road walk,Yes,Good - busy commercial street,7 PM - 11 PM,Moderate,Siripuram South Walk,"Sarvani Sweets, Waltair Main Road, Siripuram Junction",https://maps.google.com/?q=Drunken+Monkey+Siripuram+Visakhapatnam,Quick and easy walk from Siripuram junction to the quirky Drunken Monkey bar near the Sarvani Sweets landmark.
Siripuram,Theeram Kitchen & Bar,Siripuram - Sreekanya Road,Fortune Inn Srikanya Hotel,0.4,5,"From Siripuram junction, take Sreekanya Road heading west. Walk past the petrol station. Fortune Inn Srikanya Hotel is about 400 metres from the junction. Theeram Kitchen & Bar is inside the hotel lobby area.",Siripuram Junction,Fortune Inn Srikanya Hotel Entrance,Sreekanya Road,Short road walk,Yes,Good - hotel road lighting,7 PM - 11 PM,Moderate,Siripuram - Sreekanya Road,"Fortune Inn Hotel, Sreekanya Road, Waltair Main Road",https://maps.google.com/?q=Theeram+Kitchen+Bar+Fortune+Inn+Srikanya+Visakhapatnam,Short walk from Siripuram junction on Sreekanya Road to the upscale hotel bar inside Fortune Inn Srikanya.
MVP Colony,V Hangout Restobar,MVP Colony Sector 7,MVP Market Entrance - Sector 7,0.3,4,"From MVP Colony main market area in Sector 7, walk along the internal colony road towards MVP Market. V Hangout Restobar is near MVP Market in Sector 7 with signage visible from the main colony road.",MVP Colony Sector 7 Market,V Hangout Restobar Entrance,MVP Colony Internal Road - Sector 7,Colony internal road walk,Yes,Good - colony lighting,7 PM - 11 PM,Moderate,MVP Colony Nightlife Zone,"MVP Market, Sector 7, Bheemunipatnam Road",https://maps.google.com/?q=V+Hangout+Restobar+MVP+Colony+Visakhapatnam,A short colony walk in Sector 7 from the MVP market to the relaxed V Hangout Restobar.
MVP Colony,Wok Republic Lounge,MVP Colony Sector 10,MVP Colony Sector 10 Junction,0.5,6,"From MVP Colony main circle, walk towards Sector 10 along the internal road. Pass through Sector 7 towards the Bheemunipatnam Road side. Wok Republic Lounge is in Sector 10 near Bheemunipatnam Road with its sign visible from the sector road.",MVP Colony Main Circle,Wok Republic Lounge Entrance,MVP Colony Road - Sector 10,Colony road walk,Yes,Good - colony road lighting,7 PM - 11 PM,Moderate,MVP Colony North Zone,"MVP Colony Sectors, Bheemunipatnam Road, MVP Market",https://maps.google.com/?q=Wok+Republic+Lounge+MVP+Colony+Visakhapatnam,Easy colony stroll from MVP Colony main circle heading towards Sector 10 to the Wok Republic Lounge.
MVP Colony,The Hangover Pub & Kitchen - MVP,MVP Colony Sector 4,D-Mart MVP Colony,0.4,5,"From MVP Colony main junction, take the road towards Sector 4. Walk towards D-Mart superstore. The Hangover Pub and Kitchen is near D-Mart in Sector 4, easily spotted from the D-Mart parking area.",MVP Colony Main Junction,D-Mart MVP Colony,MVP Colony Sector 4 Road,Colony internal road walk,Yes,Good - commercial colony area,7 PM - 11 PM,Moderate to High,MVP Colony Pub Zone,"D-Mart, MVP Sector 4, MVP Colony Circle",https://maps.google.com/?q=The+Hangover+Pub+Kitchen+MVP+Visakhapatnam,"Short colony walk to The Hangover Pub near the D-Mart superstore in Sector 4, MVP Colony."
Dwaraka Nagar,Brew n Bistro,Dwaraka Nagar,HDFC Bank - Dwaraka Nagar,0.2,3,"From Dwaraka Nagar main circle, walk along the main road towards the HDFC Bank. Brew n Bistro is right next to the HDFC Bank branch in Dwaraka Nagar, clearly visible from the road.",Dwaraka Nagar Main Circle,HDFC Bank - Dwaraka Nagar,Dwaraka Nagar Main Road,Short commercial road walk,Yes,Excellent - commercial zone lighting,7 PM - 11 PM,Moderate,Dwaraka Nagar Zone,"HDFC Bank, Dwaraka Nagar Market, Siripuram Road",https://maps.google.com/?q=Brew+n+Bistro+Dwaraka+Nagar+Visakhapatnam,"Steps from Dwaraka Nagar main circle, a quick walk to the Brew n Bistro next to HDFC Bank."
Dwaraka Nagar,Tycoon Rooftop Lounge,Siripuram - VIP Road,Siripuram Flyover,0.9,11,"From Dwaraka Nagar circle, walk south towards Siripuram on the main road. Continue past the Dwaraka Nagar park. Take the turn at Siripuram flyover approach. Tycoon Rooftop Lounge is near the Siripuram flyover on VIP Road.",Dwaraka Nagar Circle,Siripuram Flyover Junction,Dwaraka Nagar Road then VIP Road,Neighbourhood road walk,Yes,Good - main road lighting,8 PM - 12 AM,High on weekends,Siripuram VIP Road Strip,"Siripuram Flyover, VIP Road, CMR Central",https://maps.google.com/?q=Tycoon+Rooftop+Lounge+Siripuram+VIP+Road+Visakhapatnam,Walk from Dwaraka Nagar through the main connector road to VIP Road and the Tycoon Rooftop Lounge near Siripuram flyover.
Dwaraka Nagar,Mustang Bar,Waltair Main Road,Waltair Main Road - P884 Area,1.0,12,"From Dwaraka Nagar, head towards Waltair Main Road via the connecting lane. Walk south on Waltair Main Road past the traffic signal. Mustang Bar is on Waltair Main Road with its board visible on the left side heading towards Siripuram.",Dwaraka Nagar Entrance Road,Mustang Bar - Waltair Main Road,Waltair Main Road,Commercial main road walk,Yes,Good - main road lighting,7 PM - 11 PM,Moderate,Waltair Main Road Pub Belt,"Waltair Main Road, Siripuram Area, Andhra University Side Road",https://maps.google.com/?q=Mustang+Bar+Waltair+Main+Road+Visakhapatnam,Walk from Dwaraka Nagar to the busy Waltair Main Road to reach the popular Mustang Bar on this classic nightlife street.
Asilmetta,Ironhill Brewery Visakhapatnam,Waltair Main Road,PMJ Jewellers - Waltair Main Road,0.6,8,"From Asilmetta junction, walk north on Waltair Main Road. Pass the Asilmetta park on your right. Continue towards Siripuram direction. Ironhill Brewery is above PMJ Jewellers on Waltair Main Road with the pub sign clearly lit.",Asilmetta Junction,PMJ Jewellers Building - Waltair Main Road,Waltair Main Road,Main road walk,Yes,Excellent - well-lit main road,6 PM - 11 PM,Moderate to High,Waltair Main Road Nightlife Belt,"Asilmetta Park, PMJ Jewellers, Waltair Main Road",https://maps.google.com/?q=Ironhill+Brewery+Waltair+Main+Road+Visakhapatnam,Walk along the vibrant Waltair Main Road from Asilmetta to the famous Ironhill Brewery above PMJ Jewellers.
Asilmetta,The Miami,Waltair Main Road,A Square Business Center,0.5,6,"From Asilmetta junction, walk north on Waltair Main Road. Look for A Square Business Center on your right. The Miami is on the 1st floor of A Square Business Center at Door No. 10-28-2 on Waltair Main Road.",Asilmetta Junction,A Square Business Center Entrance,Waltair Main Road,Main road walk,Yes,Excellent - main commercial road,7 PM - 11 PM,Moderate,Waltair Main Road Zone,"A Square Business Center, Waltair Main Road, Asilmetta Park",https://maps.google.com/?q=The+Miami+Waltair+Main+Road+Visakhapatnam,Short walk up Waltair Main Road from Asilmetta to the stylish Miami bar inside the A Square Business Center.
Asilmetta,Upland Bistro,Uplands - Waltair Club Area,Waltair Club Road Junction,0.7,9,"From Asilmetta junction, walk north on Waltair Main Road. Continue towards Uplands. Turn right at Waltair Club Road junction. Upland Bistro is opposite Waltair Club at door number 10-26-1/1 on Waltair Club Road.",Asilmetta Junction,Waltair Club Road Junction,Waltair Main Road then Waltair Club Road,Main road and lane walk,Yes,Good - residential uplands area,7 PM - 10 PM,Low to Moderate,Uplands Heritage Zone,"Waltair Club, Uplands Residential Area, Waltair Main Road",https://maps.google.com/?q=Upland+Bistro+Waltair+Club+Visakhapatnam,A pleasant walk from Asilmetta up Waltair Main Road to the upscale Upland Bistro in the quiet Uplands neighbourhood.
Jagadamba,Novotel Restobar & Lounge,Jagadamba Junction,Jagadamba Junction - Commissioner Office Road,0.3,4,"From Jagadamba junction circle, take the Commissioner Office Road towards YMCA. Walk about 300 metres on this road. Novotel Restobar is near YMCA on Commissioner Office Road clearly identified by the hotel signboard.",Jagadamba Junction Circle,Novotel Hotel Entrance,Commissioner Office Road,Short road walk,Yes,Excellent - city centre junction,7 PM - 11 PM,Moderate,Jagadamba - Beach Road Junction,"Jagadamba Junction, CMR Central, YMCA Ground",https://maps.google.com/?q=Novotel+Restobar+Lounge+Jagadamba+Visakhapatnam,Very short walk from the busy Jagadamba junction to the Novotel Restobar on Commissioner Office Road.
Jagadamba,MYZ - UNO Vizag,VIP Road - Siripuram,VIP Road - Central Building,0.8,10,"From Jagadamba junction, walk north on CMR Central Road towards VIP Road. Turn left onto VIP Road. Walk 400 metres towards Siripuram. MYZ UNO is in the Central Building at number 4, VIP Road visible on the left.",Jagadamba Junction,VIP Road - Central Building No. 4,CMR Road then VIP Road,City road walk,Yes,Good - commercial road,8 PM - 1 AM,High on weekends,Jagadamba - VIP Road,"CMR Central, VIP Road, Siripuram Junction",https://maps.google.com/?q=MYZ+UNO+VIP+Road+Visakhapatnam,Walk from Jagadamba through the CMR stretch to VIP Road and the trendy MYZ UNO nightlife lounge.
Jagadamba,Savera Restaurant And Bar,Jagadamba - Rama Talkies Road,Rama Talkies Road Junction,0.4,5,"From Jagadamba junction, walk west on Rama Talkies Road. Pass the medical shops cluster. Savera Restaurant and Bar is on Rama Talkies Road at P8F5 area, about 400 metres from the junction.",Jagadamba Junction,Savera Bar - Rama Talkies Road,Rama Talkies Road,City road walk,Yes,Good - active city road,6 PM - 11 PM,Moderate,Jagadamba - City Centre Zone,"Rama Talkies, Jagadamba Junction, City Centre",https://maps.google.com/?q=Savera+Restaurant+Bar+Rama+Talkies+Visakhapatnam,Short walk on Rama Talkies Road from Jagadamba junction to the budget-friendly Savera Bar and Restaurant.
